index,title,number,description
86,Developing and Designing Interactive Devices,5413,"This course covers the human-centered and technical workings behind interactive devices ranging from cell phones and video controllers to household appliances and smart cars. This is a hands-on, lab-based course. For the final project, students will build a functional IoT prototype of their own design, using Javascript, single-board Linux computer, embedded microcontrollers, and/or other electronic components. Topics include electronics prototyping, interface design, sensors and actuators, microcontroller development, physical prototyping, and user testing."
87,Applied Machine Learning,5414,"Learn and apply key concepts of modeling, analysis and validation from machine learning, data mining and signal processing to analyze and extract meaning from data. Implement algorithms and perform experiments on images, text, audio and mobile sensor measurements. Gain working knowledge of supervised and unsupervised techniques including classification, regression, clustering, feature selection, and dimensionality reduction."
88,Applied Digital Signal Processing and Communications,5415,"This course teaches some fundamentals of digital signal processing (DSP) and communication using a balanced mix between math and hands-on experiments. The course will start by teaching basic concepts in signals and systems. We will then cover topics in time-frequency analysis, sampling, filters, audio signal communication, quantization, source coding, and compressed sensing. We will use multiple hands-on programming assignments to demonstrate the concepts we cover in class and problem sets that will help students practice with the theory. A background in linear algebra and probability will be critical to follow the theoretical aspects. All coding will be done in Python."
89,Fundamentals of Machine Learning,5420,"The course will be devoted to understanding, implementation, and applications of various machine learning primitives. This course is intended to have three modules, and within each we will cover basic theory, and implementations. The modules will be supervised learning, unsupervised learning, and finally topics that are motivated by engineering applications such as speech recognition, and recommendation systems. Supervised learning will include regression, support vector machines, decision trees, random forests, naïve Bayes, boosting and bagging. Unsupervised learning includes clustering, k-means, k-NN, principal components analysis and other dimensionality reduction methods. We will give particular emphasis on engineering applications, e.g., text data, hand-writing, music, image, and time series data, and categorical datasets such those in recommendation systems. The course will have a programming component, which will be administered in the form of assignments, and in-class-kaggle competition"
90,Computer Vision,5470,"Covers computer acquisition and analysis of image data with emphasis on techniques for robot vision. Concentrates on descriptions of objects at three levels of abstraction: segmented images (images organized into subimages that are likely to correspond to interesting objects), geometric structures (quantitative models of image and world structures), and relational structures (complex symbolic descriptions of images and world structures). The programming of several computer-vision algorithms is required."
91,Electric Power Systems I,5510,"Acquaints students with modern electric power system modeling, analysis and computation. Stresses analysis techniques appropriate for power system modeling, analysis and power flow computation. Topics include transmission line models, transformers and per unit system, generator models, network matrices, power flow analysis and computation, real and reactive power control, voltage control, economic dispatch."
92,Introduction to Digital (VLSI) Design,5515,"Course is equal parts analytical and real-world practical design. Analytical topics include basic transistor physics, switching behavior of transistors, interconnect modelling, combinational and sequential logic, memories, timing analysis, optimization, computer arithmetic, and architecture transforms. Practical topics include routing strategies, floor planning and other application/specification-driven decision-making considerations for the multi-variate CMOS digital design space. Emphasis will be on full-custom design using Cadence."
93,Power System Economics and Electricity Markets,5520,"This graduate-level course covers the fundamentals of power systems economics and electricity markets, emphasizing the application of microeconomics and optimization tools.  The course introduces basic microeconomic concepts in the context of retail and wholesale electricity markets:  consumer preference, consumer choice, production costs and profit maximization, individual and market demand and supply functions, competitive markets and equilibria, welfare optimization, market power, monopoly and price discrimination, regulated monopoly and utility pricing. The course covers electricity market design: energy markets, reserve markets, ancillary service markets, capacity markets, ancillary service markets, scarcity pricing, capacity markets, financial transmission rights, inter-regional transaction markets, and virtual transaction markets.  Advanced topics on distributed energy resources and energy aggregation are discussed and assigned as part of class projects."
94,Analog Integrated Circuit Design,5530,"Overview of devices available to analog integrated-circuit designers in modern CMOS and BiCMOS processes: resistors, capacitors, MOS transistors, and bipolar transistors. Basic building blocks for linear analog integrated circuits: single-stage amplifiers, current mirrors, and differential pairs. Transistor-level design of linear analog integrated circuits, such as operational amplifiers and operational transconductance amplifiers. Layout techniques for analog integrated circuits. Throughout the course, emphasis is placed on design-oriented analysis techniques."
95,Power Electronics,5560,"Power electronics is an enabling technology for sustainable and energy efficient systems, as all renewable energy sources (including solar and wind) and efficient electrical loads (including LED lighting and electric vehicles) require a power electronic converter to interface them with the electrical grid. Power electronic converters, being inherently non-linear/time-variant circuits, cannot be analyzed using linear time-invariant (LTI) circuit analysis techniques, nor conventional small-signal linearization techniques taught in introductory circuits (ECE 2100) and microelectronics (ECE 3150) courses. This course, which will follow ECE 3150, will introduce advanced circuit analysis and modeling techniques required to predict the steady-state and dynamic behavior of power electronic converters. The course will also introduce seniors and first-year graduate students to other advanced topics which are required for the analysis and design of power converters, including power semiconductor device modeling, thermal modeling, magnetic component modeling, electromagnetic interference (EMI) filter design, and switching converter control design, at a level appropriate for them. This course will equip ECE students with the theoretical and practical skills needed to innovate in the area of power electronics, and allow them to succeed in graduate school and in the rapidly growing job market for power electronic engineers."
96,Computer Networks and Telecommunications,5660,"This is a senior-level course in information networking with an emphasis on wireless technology. Examples of topics include: 5G cellular, the latest WiFi standards, Bluetooth, routing and switching, congestion control, network security, and user privacy. Though the focus will be on communication networking technologies, downstream legal and social issues that arise from design decisions will be discussed."
97,Radio Frequency Systems,5690,"This course addresses the design of radio-frequency links in the component view to enable eventual full-duplex, multi-access wireless network. The analysis will reside mostly in the signal (SIMULINK) level instead of the circuit implementation, although the nonideal circuit characteristics will be reflected in the signal representation. Federal Communications Commission (FCC) and Occupational Safety & Health Administration (OSHA) standards will be introduced. Existing standard protocols will be selectively introduced including FM, TV broadcast, Bluetooth, Z-wave, Zigbee and Wi-fi to enable intuitive understanding of RF system tradeoffs."
98,Design with Embedded Operating Systems,5725,"Design of microcontroller based systems using embedded Linux. Student teams design and debug example solutions on a target microcontroller (for example, Raspberry Pi) during lab sessions. Emphasis will be on application and Linux programming skills, processor and microcontroller architecture with some discussion of hardware interfaces. Students create a final, end-ofsemester project using the microcontroller platform and development techniques discussed during the semester."
99,Digital Systems Design Using Microcontrollers,5730,"Design of real-time digital systems using microprocessor-based embedded controllers. Students working in pairs design, debug, and construct several small systems that illustrate and employ the techniques of digital system design acquired in previous courses. The content focuses on the laboratory work. The lectures are used primarily for the introduction of examples, description of specific modules to be designed, and instruction in the hardware and high-level design tools to be employed."
100,Computer Architecture,5740,"This course aims to provide a strong foundation for students to understand modern computer system architecture and to apply these insights and principles to future computer designs. The course is structured around the three primary building blocks of general-purpose computing systems: processors, memories, and networks. The first half of the course focuses on the fundamentals of each building block. Topics include processor microcoding and pipelining; cache microarchitecture and optimization; and network topology, routing, and flow control. The second half of the course delves into more advanced techniques and will enable students to understand how these three building blocks can be integrated to build a modern shared-memory multicore system. Topics include superscalar execution, branch prediction, out-of-order execution, register renaming and memory disambiguation; VLIW, vector, and multithreaded processors; memory protection, translation, and virtualization; and memory synchronization, consistency, and coherence. This course includes a significant project decomposed into five lab assignments. Throughout the semester, students will gradually design, implement, test, and evaluate a complete multicore system capable of running real parallel applications at the register-transfer level."
101,Advanced Computer Architecture,5750,"This course discusses advanced topics in computer architecture beyond the material that is covered in undergraduate courses such as ECE 4750/CS 4420. In particular, the course places special focus on multicore and multiprocessor architectures (coherence, consistency, synchronization, interconnects, OS support, etc.), as well as advanced architecture techniques (simultaneous multithreading, speculative loads and stores, neural branch predictors, hardware resource management, memory scheduling, etc.) Students work on parallel programming assignments that emphasize hardware-aware performance optimization."
102,Control and Optimization of Information Networks,5800,"Introduction to current research directions in networking featuring the Internet. Assumes basic knowledge of signals and systems as well as random processes. Necessary tools from optimization, dynamical systems, and related economic theory are introduced. Research topics may include layering, routing, medium access control, flow control, and peer-to-peer networks. Students are expected to hand in homework assignments, discuss one set of papers in class, and participate in a course project."
